question_id,category,question
Q-178,caiq|hrs,"Are background verification policies and procedures of all new employees (including
but not limited to remote employees, contractors, and third parties) established,
documented, approved, communicated, applied, evaluated, and maintained?"
Q-179,caiq|hrs,"Are background verification policies and procedures designed according to
local laws, regulations, ethics, and contractual constraints and proportional
to the data classification to be accessed, business requirements, and acceptable
risk?"
Q-180,caiq|hrs,"Are background verification policies and procedures reviewed and updated at
least annually, or upon significant changes?"
Q-181,caiq|hrs,"Are policies and procedures for defining allowances and conditions for the
acceptable use of organizationally-owned or managed assets established, documented,
approved, communicated, applied, evaluated, and maintained?"
Q-182,caiq|hrs,"Are the policies and procedures for defining allowances and conditions for
the acceptable use of organizationally-owned or managed assets reviewed and updated
at least annually, or upon significant changes?"
Q-183,caiq|hrs,"Are policies and procedures requiring unattended workspaces to conceal confidential
data established, documented, approved, communicated, applied, evaluated, and
maintained?"
Q-184,caiq|hrs,"Are policies and procedures requiring unattended workspaces to conceal confidential
data reviewed and updated at least annually, or upon significant changes?"
Q-185,caiq|hrs,"Are policies and procedures to protect information accessed, processed, or
stored at remote sites and locations established, documented, approved, communicated,
applied, evaluated, and maintained?"
Q-186,caiq|hrs,"Are policies and procedures to protect information accessed, processed, or
stored at remote sites and locations reviewed and updated at least annually, or upon significant changes?"
Q-187,caiq|hrs,"Are return procedures of organizationally-owned assets by terminated employees
established and documented?"
Q-188,caiq|hrs,"Are procedures outlining the roles and responsibilities concerning changes
in employment established, documented, and communicated to all relevant personnel?"
Q-189,caiq|hrs,"Are employees required to sign an employment agreement before gaining access
to organizational information systems, resources, and assets?"
Q-190,caiq|hrs,"Are provisions and/or terms for adherence to established information governance
and security policies included within employment agreements?"
Q-191,caiq|hrs,"Are employee roles and responsibilities relating to information assets' security 
and privacy, established, documented and communicated?"
Q-192,caiq|hrs,"Are requirements for non-disclosure/confidentiality agreements reflecting
organizational data protection needs and operational details identified, documented,
and reviewed at planned intervals?"
Q-193,caiq|hrs,"Is a security awareness training program for all employees of the organization
established, documented, approved, communicated, applied, evaluated and maintained?"
Q-194,caiq|hrs,Are regular security awareness training updates provided?
Q-195,caiq|hrs,"Are employees granted access to sensitive organizational and personal
data provided with appropriate security awareness training?"
Q-196,caiq|hrs,"Are employees granted access to sensitive organizational and personal
data provided with regular updates in procedures, processes, and policies relating
to their professional function?"
Q-197,caiq|hrs,"Are employees notified of their roles and responsibilities to maintain awareness
and compliance with established policies, procedures, and applicable legal, statutory,
or regulatory compliance obligations?"
Q-198,caiq|iam,"Are identity and access management policies and procedures established, documented,
approved, communicated, implemented, applied, evaluated, and maintained?"
Q-199,caiq|iam,"Are identity and access management policies and procedures reviewed and updated
at least annually, or upon significant changes?"
Q-200,caiq|iam,"Are policies and procedures for the management of authentication credentials, 
including passwords, established, documented,  approved, communicated, implemented, applied, evaluated, and maintained?"
Q-201,caiq|iam,"Are policies and procedures reviewed and updated at least annually, or upon significant changes?"
Q-202,caiq|iam,"Is the inventory of identities managed, stored, and regularly reviewed, and is their level of access monitored?"
Q-203,caiq|iam,"Is the separation of duties principle employed when implementing information
system access?"
Q-204,caiq|iam,"Is the least privilege principle employed when implementing information system
access?"
Q-205,caiq|iam,"Is an identity access provisioning process defined and implemented which 
authorizes, records, and communicates data and assets access changes?"
Q-206,caiq|iam,Is a process in place to de-provision or modify identity access in a timely manner?
Q-207,caiq|iam,"Are reviews and revalidation of identity access for least privilege and separation of duties 
completed with a frequency commensurate with organizational risk tolerance, and 
at least annually or upon significant changes?"
Q-208,caiq|iam,"Are processes, procedures, and technical measures for the segregation of privileged
access roles defined, implemented, and evaluated?"
Q-209,caiq|iam,"Is an access process defined and implemented to ensure privileged access roles
and rights are granted for a limited period?"
Q-210,caiq|iam,Are procedures implemented to prevent the accumulation of segregated privileged access?
Q-211,caiq|iam,"Are processes and procedures for service customers to participate, where applicable, in 
granting access for agreed, high risk as (defined by the organizational risk assessment) 
privileged access roles defined, implemented and evaluated?"
Q-212,caiq|iam,"Are processes, procedures, and technical measures that ensure identities' activities are 
identifiable through uniquely associated IDs defined, implemented, and evaluated?"
Q-213,caiq|iam,"Are processes, procedures, and technical measures for authenticating access
to systems, application, and data assets including multifactor authentication
for a least-privileged user and sensitive data access defined, implemented, and
evaluated?"
Q-214,caiq|iam,"Are digital certificates or alternatives that achieve an equivalent security
level for system identities adopted?"
Q-215,caiq|iam,"Are processes, procedures, and technical measures for the secure management 
of authentication credentials, including passwords, defined, implemented, and evaluated?"
Q-216,caiq|iam,"Are processes, procedures, and technical measures to verify access to data
and system functions authorized, defined, implemented, and evaluated?"
Q-217,caiq|ipy,"Are policies and procedures established, documented, approved, communicated,
applied, evaluated, and maintained for communications between application interfaces
(e.g., APIs)?"
Q-218,caiq|ipy,"Are policies and procedures established, documented, approved, communicated,
applied, evaluated, and maintained for information processing interoperability?"
Q-219,caiq|ipy,"Are policies and procedures established, documented, approved, communicated,
applied, evaluated, and maintained for application development portability?"
Q-220,caiq|ipy,"Are policies and procedures established, documented, approved, communicated,
applied, evaluated, and maintained for information/data exchange, usage, portability,
integrity, and persistence?"
Q-221,caiq|ipy,"Are interoperability and portability policies and procedures reviewed and
updated at least annually, or upon significant changes?"
Q-222,caiq|ipy,"Are service customers able to programmatically retrieve their data via an application interface(s)
to enable interoperability and portability?"
Q-223,caiq|ipy,"Are cryptographically secure network protocols implemented for the management, import, and export 
of data in accordance with industry standards?"
Q-224,caiq|ipy,"Do agreements include provisions specifying service customers' data access upon contract termination, and have the following?
a. Data format
b. Duration data will be stored
c. Scope of the data retained and made available to the service customers
d. Data deletion policy"
Q-225,caiq|i&s,"Are infrastructure and virtualization security policies and procedures established,
documented, approved, communicated, applied, evaluated, and maintained?"
Q-226,caiq|i&s,"Are infrastructure and virtualization security policies and procedures reviewed
and updated at least annually, or upon significant changes?"
Q-227,caiq|i&s,"Is resource availability, quality, and capacity planned and monitored in a
way that delivers required system performance, as determined by the business?"
Q-228,caiq|i&s,"Are communications between environments, services, and applications monitored?"
Q-229,caiq|i&s,"Are communications between environments, services, and applications encrypted?"
Q-230,caiq|i&s,"Are communications between environments, services, and applications restricted to 
only authenticated and authorized connections, as justified by the business?"
Q-231,caiq|i&s,Are network configurations reviewed at least annually?
Q-232,caiq|i&s,"Are network configurations supported by the documented justification of all
allowed services, protocols, ports, and compensating controls?"
Q-233,caiq|i&s,"Is every host and guest OS, hypervisor, or infrastructure control plane hardened
(according to their respective best practices) and supported by technical controls
as part of a security baseline?"
Q-234,caiq|i&s,"Are the environments separated into production and non production environments to reduce the risk of sensitive 
production data being used in non-production environments?"
Q-235,caiq|i&s,Is production data sanitized or protected before being used for any authorized non-production purpose?
Q-236,caiq|i&s,"Are applications and infrastructures designed, developed, deployed, and configured such that service customer (tenant) 
access is appropriately segmented, segregated, monitored, and restricted?"
Q-237,caiq|i&s,"Are secure and encrypted communication channels including only up-to-date
and approved protocols used when migrating servers, services, applications, or
data to cloud environments?"
Q-238,caiq|i&s,"Are high-risk environments identified and documented based on 
data sensitivity, threat exposure, and business impact?"
Q-239,caiq|i&s,"Are processes, procedures, and defense-in-depth techniques defined, implemented,
and evaluated for protection, detection, and timely response to network-based
attacks?"
Q-240,caiq|log,"Are logging and monitoring policies and procedures established, documented,
approved, communicated, applied, evaluated, and maintained?"
Q-241,caiq|log,"Are policies and procedures reviewed and updated at least annually, or upon significant changes?"
Q-242,caiq|log,"Are processes, procedures, and technical measures defined, implemented, and
evaluated to ensure audit log security and retention?"
Q-243,caiq|log,"Are security-related events identified and monitored within applications and
the underlying infrastructure?"
Q-244,caiq|log,"Is a system defined and implemented to generate alerts to responsible stakeholders
based on security events and their corresponding metrics?"
Q-245,caiq|log,"Is audit log access restricted to authorized identities, and are records of that access maintained?"
Q-246,caiq|log,"Are capabilities implemented and maintained to correlate and monitor security audit logs for the 
detection of suspicious or anomalous activity that deviates from typical or expected patterns?"
Q-247,caiq|log,"Is a process established and followed to review and take appropriate and timely
actions on detected anomalies?"
Q-248,caiq|log,"Is a reliable time source being used across all relevant information processing
systems?"
Q-249,caiq|log,"Are logging requirements for information meta/data system events established,
documented, and implemented?"
Q-250,caiq|log,"Is the scope reviewed and updated at least annually, or whenever there is a 
change in the threat environment and as per relevant regulatory requirements?"
Q-251,caiq|log,"Are technical measures defined, implemented, and evaluated to enable service customers to 
detect and scrub or tokenize sensitive data from logs, in order to prevent unauthorized 
exposure as per applicable laws and regulations?"
Q-252,caiq|log,"Are audit records generated, and do they contain relevant security information?"
Q-253,caiq|log,"Are audit records protected from unauthorized access, modification, and deletion?"
Q-254,caiq|log,"Are monitoring and internal reporting capabilities established to report on
cryptographic operations, encryption, and key management policies, processes,
procedures, and controls?"
Q-255,caiq|log,"Are key lifecycle management events logged and monitored to enable auditing
and reporting on cryptographic keys' usage?"
Q-256,caiq|log,"Is physical access logged and monitored using an auditable access control
system?"
Q-257,caiq|log,"Are processes and technical measures for reporting monitoring system anomalies
and failures defined, implemented, and evaluated?"
Q-258,caiq|log,Are accountable parties immediately notified about anomalies and failures?
Q-259,caiq|sef,"Are policies and procedures for security incident management, e-discovery,
and cloud forensics established, documented, approved, communicated, applied,
evaluated, and maintained?"
Q-260,caiq|sef,"Are policies and procedures reviewed and updated annually, or upon significant changes?"
Q-261,caiq|sef,"Are policies and procedures for timely management of security incidents established,
documented, approved, communicated, applied, evaluated, and maintained?"
Q-262,caiq|sef,"Are policies and procedures for timely management of security incidents reviewed
and updated at least annually, or upon significant changes?"
Q-263,caiq|sef,"Is a security incident response plan that includes a communication strategy for notifying 
relevant internal departments, impacted service customers, and other business-critical 
relationships (such as supply-chain) established, documented, approved, communicated, applied, evaluated, and maintained?"
Q-264,caiq|sef,Is a structured approach followed to evaluate the effectiveness of incident response plans at planned intervals or upon significant changes?
Q-265,caiq|sef,"Are information security incident metrics established, monitored and reported?"
Q-266,caiq|sef,"Are processes, procedures, and technical measures supporting business processes
to triage security-related events defined, implemented, and evaluated?"
Q-267,caiq|sef,"Are processes, procedures, and technical measures defined, implemented, and evaluated for 
timely and effective response to security incidents in accordance with incident categories and severity levels?"
Q-268,caiq|sef,"Are these processes and procedures reviewed, updated, and tested at least annually?"
Q-269,caiq|sef,"Are processes, procedures, and technical measures for security breach notifications
defined and implemented?"
Q-270,caiq|sef,"Are material security breaches reported (including any relevant supply chain breaches) 
as per applicable SLAs, laws, and regulations?"
Q-271,caiq|sef,Is a secure repository of security incident records established and maintained?
Q-272,caiq|sef,"Are incident records regularly reviewed to identify patterns, root causes, and systemic 
vulnerabilities, and are relevant corrective measures implemented?"
Q-273,caiq|sef,"Are points of contact maintained for applicable regulation authorities, national
and local law enforcement, and other legal jurisdictional authorities?"
Q-274,caiq|sef,Are points of contact reviewed and updated at least annually?
Q-275,caiq|sta,"Are policies and procedures for supply chain risk management established, documented, approved, 
communicated, applied, evaluated, and maintained?"
Q-276,caiq|sta,"Are policies and procedures for supply chain risk management reviewed and updated 
at least annually, or upon significant changes?"
Q-277,caiq|sta,"Are policies and procedures implementing the shared security responsibility
model (SSRM) within the organization established, documented, approved, communicated,
applied, evaluated, and maintained?"
Q-278,caiq|sta,"Are the policies and procedures that apply the SSRM reviewed and updated annually, or upon significant changes?"
Q-279,caiq|sta,"Is the SSRM applied, documented, implemented, and managed throughout the supply
chain?"
Q-280,caiq|sta,"Is the service customer given SSRM guidance detailing information about SSRM applicability
throughout the supply chain?"
Q-281,caiq|sta,"Is the shared ownership and applicability of all CSA CCM controls delineated
according to the SSRM?"
Q-282,caiq|sta,Is the SSRM documentation reviewed and validated?
Q-283,caiq|sta,"Are the portions of the SSRM the organization is responsible for implemented,
operated, audited, or assessed?"
Q-284,caiq|sta,Is an inventory of all supply chain relationships developed and maintained?
Q-285,caiq|sta,"Is a process defined, implemented, and enforced for establishing a Bill of Material 
for the service supply chain?"
Q-286,caiq|sta,Is the Bill of Material reviewed and updated at least annually or upon significant changes?
Q-287,caiq|sta,Are risk factors associated with supply chain relationships periodically reviewed?
Q-288,caiq|sta,"Do service agreements between service providers and service customers (tenants) incorporate at least the following mutually agreed upon provisions and/or terms?
• Scope, characteristics, and location of business relationship and services offered
• Information security requirements (including SSRM)
• Change management process
• Logging and monitoring capability
• Incident management and communication procedures
• Right to audit and third-party assessment
• Service termination
• Interoperability and portability requirements
• Data privacy
• Operational Resilience"
Q-289,caiq|sta,Are supply chain agreements reviewed at least annually or upon significant changes?
Q-290,caiq|sta,"Is there a process for conducting internal assessments at least annually to
confirm the conformance and effectiveness of standards, policies, procedures,
and SLA activities?"
Q-291,caiq|sta,"Are policies that require all supply chain service providers to comply with information
security, confidentiality, access control, privacy, audit, personnel policy, and
service level requirements and standards implemented?"
Q-292,caiq|sta,"Are the organization's service providers' IT governance policies and procedures reviewed 
at least annually or upon significant changes?"
Q-293,caiq|sta,Is a process defined and implemented for conducting risk-based security assessments of the supply chain?
Q-294,caiq|tvm,"Are policies and procedures established, documented, approved, communicated,
applied, evaluated, and maintained to identify, report, and prioritize the remediation
of vulnerabilities and threats to protect systems against vulnerability exploitation?"
Q-295,caiq|tvm,"Are threat and vulnerability management policies and procedures reviewed and
updated at least annually, or upon significant changes?"
Q-296,caiq|tvm,"Are policies and procedures to protect against malware and malicious instructions 
established, documented, approved, communicated, applied, evaluated, and maintained?"
Q-297,caiq|tvm,"Are asset management and malware protection policies and procedures reviewed
and updated at least annually, or upon significant changes?"
Q-298,caiq|tvm,"Are processes, procedures, and technical measures defined, implemented, and evaluated for 
vulnerability detection on organizationally managed assets at least monthly?"
Q-299,caiq|tvm,"Are a threat analysis process and procedures defined, implemented, and evaluated to identify, 
assess, and review the threat landscape for cloud systems?"
Q-300,caiq|tvm,Are threat models built according to industry best practices to inform the risk mitigation strategy?
Q-301,caiq|tvm,"Are processes, procedures, and technical measures defined, implemented, and
evaluated to update detection tools, threat signatures, and compromise indicators
weekly (or more frequent) basis?"
Q-302,caiq|tvm,"Are processes, procedures, and technical measures defined, implemented, and
evaluated to identify updates for applications that use third-party or open-source
libraries (according to the organization's vulnerability management policy)?"
Q-303,caiq|tvm,"Are processes, procedures and technical measures defined, implemented and evaluated for 
the periodic performance of penetration testing by independent third parties?"
Q-304,caiq|tvm,"Are processes, procedures and technical measures defined, implemented and evaluated 
based on identified risks to support scheduled and emergency responses to vulnerability identification?"
Q-305,caiq|tvm,"Is vulnerability remediation prioritized using a risk-based method from an
industry-recognized framework?"
Q-306,caiq|tvm,"Is a risk-based method used for the prioritization and mitigation of threats, leveraging 
an industry-recognized framework to guide threat decision-making and protection measures?"
Q-307,caiq|tvm,"Is a process defined and implemented to track and report vulnerability identification
and remediation activities that include stakeholder notification?"
Q-308,caiq|tvm,"Are metrics for vulnerability identification and remediation established,
monitored, and reported at defined intervals?"
Q-309,caiq|uem,"Are policies and procedures established, documented, approved, communicated,
applied, evaluated, and maintained for all endpoints?"
Q-310,caiq|uem,"Are universal endpoint management policies and procedures reviewed and updated
at least annually, or upon significant changes?"
Q-311,caiq|uem,"Is there a defined, documented, applicable and evaluated list containing approved
services, applications, and the sources of applications (stores) acceptable for
use by endpoints when accessing or storing organization-managed data?"
Q-312,caiq|uem,"Is a process defined and implemented to validate endpoint device compatibility
with operating systems and applications?"
Q-313,caiq|uem,"Is an inventory of all endpoints used and maintained to store, access and process company
data?"
Q-314,caiq|uem,"Are processes, procedures, and technical measures defined, implemented and
evaluated, to enforce policies and controls for all endpoints permitted to access
systems and/or store, transmit, or process organizational data?"
Q-315,caiq|uem,"Are all relevant interactive-use endpoints configured to require an automatic
lock screen?"
Q-316,caiq|uem,"Are changes to endpoint operating systems, patch levels, and/or applications
managed through the organizational change management process?"
Q-317,caiq|uem,"Is information protected from unauthorized disclosure on managed endpoints
with storage encryption?"
Q-318,caiq|uem,"Are anti-malware detection and prevention technology services configured on
managed endpoints?"
Q-319,caiq|uem,Are software firewalls configured on managed endpoints?
Q-320,caiq|uem,"Are managed endpoints configured with data loss prevention (DLP) technologies
and rules per a risk assessment?"
Q-321,caiq|uem,"Are remote geo-location capabilities enabled for all managed mobile endpoints, 
in accordance with applicable laws and regulations?"
Q-322,caiq|uem,"Are processes, procedures, and technical measures defined, implemented, and
evaluated to enable remote company data deletion on managed endpoint devices?"
Q-323,caiq|uem,"Are processes, procedures, and technical and/or contractual measures defined,
implemented, and evaluated to maintain proper security of third-party endpoints
with access to organizational assets?"
